{"SchemaVersion":1,"ReportKind":"build","GeneratedAtUtc":"2026-08-11T00:00:00.0000000Z","Machine":"fixture","Git":{"Branch":"main","Commit":"1111111111111111111111111111111111111111"},"ScriptName":"scripts/build-skills.ps1","Mode":"build","Summary":{},"Details":{},"Result":"PASS","NextAction":"Review the canonical transaction plan."}
